{
 "schemaVersion": "roadnaturalist-investigator-probes/1",
 "kind": "investigator-probe-catalog",
 "corridorNote": "Corridors the catalog declares. A probe lists the corridors it applies to; a probe with no corridorIds applies to every corridor in the catalog.",
 "policyNote": "policyProfile is a logical name only. The Worker maps it to a cache lifetime; byte caps, timeouts, redirect policy, accepted content types and the host allow-list are server policy in worker/investigator/policies.js and cannot be set from this file.",
 "corridors": [
  {
   "id": "or-roads-cornelius-pass-rd",
   "name": "NW Cornelius Pass Rd"
  },
  {
   "id": "or-roads-springville-rd",
   "name": "NW Springville Rd"
  },
  {
   "id": "or-roads-susbauer-rd",
   "name": "NW Susbauer Rd"
  }
 ],
 "probes": [
  {
   "id": "odot-cornelius-transfer",
   "stage": "access-research",
   "kind": "authority",
   "organization": "Oregon Department of Transportation",
   "authority": "state:odot",
   "sourceClass": "TIER_1_AUTHORITATIVE",
   "sourceType": "state agency bulletin",
   "title": "Cornelius Pass Road Jurisdictional Transfer Complete (ODOT bulletin, March 1 2021)",
   "url": "https://content.govdelivery.com/accounts/ORDOT/bulletins/2c218b2",
   "question": "Does an authoritative source state that this road is a public road?",
   "appliesTo": "NW Cornelius Pass Road",
   "corridorIds": [
    "or-roads-cornelius-pass-rd"
   ],
   "policyProfile": "jurisdiction-document",
   "facts": [
    {
     "find": "NW Cornelius Pass Road between U.S. 30 and U.S. 26 is a state highway as of Monday, March 1 after a jurisdictional transfer from Multnomah County and Washington County.",
     "claimType": "PUBLIC_ROAD",
     "claimValue": "state highway OR 127",
     "claimStrength": "stated",
     "scope": "CORRIDOR",
     "summary": "ODOT states that NW Cornelius Pass Road between U.S. 30 and U.S. 26 became a state highway on March 1 2021, transferred from Multnomah and Washington counties."
    },
    {
     "find": "As a state highway, the road will be subject to ODOT standards for design and maintenance",
     "claimType": "ROAD_MAINTAINED",
     "claimValue": "ODOT design and maintenance standards",
     "claimStrength": "stated",
     "scope": "CORRIDOR",
     "summary": "ODOT states the road is subject to ODOT standards for design and maintenance."
    }
   ]
  },
  {
   "id": "wc-cornelius-bridge-project",
   "stage": "contradiction-search",
   "kind": "closure",
   "organization": "Washington County Land Use & Transportation",
   "authority": "county:washington",
   "sourceClass": "TIER_1_AUTHORITATIVE",
   "sourceType": "county project page",
   "title": "Cornelius Pass Road Bridge at Rock Creek Replacement (Washington County project page)",
   "url": "https://www.washingtoncountyor.gov/lut/projects/cornelius-pass-road-bridge-rock-creek",
   "question": "Is any part of this road closed, gated, or restricted right now, and who controls it?",
   "appliesTo": "Cornelius Pass Road",
   "corridorIds": [
    "or-roads-cornelius-pass-rd"
   ],
   "policyProfile": "closure-status",
   "facts": [
    {
     "find": "Road closure has been extended to October 7, 2026",
     "claimType": "TEMPORARY_CLOSURE",
     "claimValue": "full closure for bridge replacement",
     "claimStrength": "stated",
     "scope": "CORRIDOR_PART",
     "corridorPart": "bridge over Rock Creek, north of Germantown Road",
     "effectiveFrom": "2026-07-15",
     "effectiveUntil": "2026-10-07",
     "windowQuote": "Road closure has been extended to October 7, 2026",
     "summary": "Washington County states the full road closure for the Rock Creek bridge replacement is extended to October 7 2026."
    },
    {
     "find": "Jurisdiction of Cornelius Pass Road has transferred to ODOT, and is now OR 127.",
     "claimType": "LAND_MANAGER",
     "claimValue": "ODOT (OR 127)",
     "claimStrength": "stated",
     "scope": "CORRIDOR_PART",
     "corridorPart": "the OR 127 section",
     "summary": "Washington County states jurisdiction of Cornelius Pass Road transferred to ODOT and the road is now OR 127."
    },
    {
     "find": "Once complete, the bridge will be transferred to ODOT for all future maintenance.",
     "claimType": "LAND_MANAGER",
     "claimValue": "ODOT (future maintenance)",
     "claimStrength": "stated",
     "scope": "CORRIDOR_PART",
     "corridorPart": "the new Rock Creek bridge",
     "summary": "Washington County states the replacement bridge will be transferred to ODOT for future maintenance."
    },
    {
     "find": "No trucks are allowed on Old Cornelius Pass Road.",
     "claimType": "ROAD_NAME_VARIANT",
     "claimValue": "Old Cornelius Pass Road",
     "claimStrength": "stated",
     "scope": "CORRIDOR_PART",
     "corridorPart": "Old Cornelius Pass Road (a separate road used as the detour)",
     "summary": "The county detour notice restricts trucks on Old Cornelius Pass Road, which is not the corridor: a similarly named but different road. The restriction does not apply to NW Cornelius Pass Rd."
    }
   ]
  },
  {
   "id": "wc-cornelius-closure-news",
   "stage": "contradiction-search",
   "kind": "closure",
   "organization": "Washington County Land Use & Transportation",
   "authority": "county:washington",
   "sourceClass": "TIER_1_AUTHORITATIVE",
   "sourceType": "county news release",
   "title": "Safety and Freight Improvements: Cornelius Pass Road Bridge Replacement at Rock Creek (July 9 2026)",
   "url": "https://www.washingtoncountyor.gov/lut/news/2026/07/09/safety-and-freight-improvements-cornelius-pass-road-bridge-replacement-rock-creek",
   "question": "Which exact section of the road is closed, and for how long?",
   "appliesTo": "Cornelius Pass Road (OR-127)",
   "corridorIds": [
    "or-roads-cornelius-pass-rd"
   ],
   "policyProfile": "closure-status",
   "facts": [
    {
     "find": "Cornelius Pass Road (OR-127) will be closed between Germantown Road and Kaiser Road from July 15 to October 7, 2026",
     "claimType": "TEMPORARY_CLOSURE",
     "claimValue": "full closure between Germantown Road and Kaiser Road",
     "claimStrength": "stated",
     "scope": "CORRIDOR_PART",
     "corridorPart": "between Germantown Road and Kaiser Road",
     "effectiveFrom": "2026-07-15",
     "effectiveUntil": "2026-10-07",
     "windowQuote": "from July 15 to October 7, 2026",
     "summary": "Washington County states Cornelius Pass Road (OR-127) is closed between Germantown Road and Kaiser Road from July 15 to October 7 2026, with detours in place."
    }
   ]
  },
  {
   "id": "wc-roads-cornelius-advisory",
   "stage": "contradiction-search",
   "kind": "closure",
   "organization": "Washington County Road Closures & Traffic Advisories (wc-roads.com)",
   "authority": "county:washington",
   "sourceClass": "TIER_1_AUTHORITATIVE",
   "sourceType": "county road-status service",
   "title": "Road Closures & Traffic Advisories (current advisory list)",
   "url": "https://www.wc-roads.com/",
   "question": "Does the county road-status service list a current restriction on this road?",
   "appliesTo": "Cornelius Pass Road",
   "corridorIds": [
    "or-roads-cornelius-pass-rd"
   ],
   "policyProfile": "closure-status",
   "facts": [
    {
     "find": "Cornelius Pass Road From/To: At Rock Creek (View Detour Map) Impact: Road closure Reason: Bridge replacement Schedule: From: 07/15/2026 To: 10/07/2026 Use alternate route",
     "claimType": "TEMPORARY_CLOSURE",
     "claimValue": "road closure at Rock Creek",
     "claimStrength": "stated",
     "scope": "CORRIDOR_PART",
     "corridorPart": "at Rock Creek",
     "effectiveFrom": "2026-07-15",
     "effectiveUntil": "2026-10-07",
     "windowQuote": "To: 10/07/2026",
     "summary": "The county advisory list carries a current road closure on Cornelius Pass Road at Rock Creek for bridge replacement, 07/15/2026 to 10/07/2026."
    }
   ]
  },
  {
   "id": "mc-cornelius-rcip",
   "stage": "access-research",
   "kind": "authority",
   "organization": "Multnomah County Transportation",
   "authority": "county:multnomah",
   "sourceClass": "TIER_1_AUTHORITATIVE",
   "sourceType": "county capital plan",
   "title": "Multnomah County Roads Capital Improvement Plan \u2014 project rankings (last reviewed December 3 2024)",
   "url": "https://multco.us/info/rcip-project-rankings",
   "question": "Does the other county that names this road still treat it as a road it maintains?",
   "appliesTo": "NW Cornelius Pass Road",
   "corridorIds": [
    "or-roads-cornelius-pass-rd"
   ],
   "policyProfile": "jurisdiction-document",
   "facts": [
    {
     "find": "NW Cornelius Pass Road: Highway 30 - Skyline Boulevard",
     "claimType": "ROAD_MAINTAINED",
     "claimValue": "ranked county road project",
     "claimStrength": "stated",
     "scope": "CORRIDOR_PART",
     "corridorPart": "Highway 30 \u2013 Skyline Boulevard (Multnomah County section)",
     "summary": "Multnomah County lists NW Cornelius Pass Road (Highway 30 \u2013 Skyline Boulevard) among the road projects in its Roads Capital Improvement Plan."
    },
    {
     "find": "NW Cornelius Pass Road: Skyline Boulevard - County Line",
     "claimType": "ROAD_MAINTAINED",
     "claimValue": "ranked county road project",
     "claimStrength": "stated",
     "scope": "CORRIDOR_PART",
     "corridorPart": "Skyline Boulevard \u2013 county line (Multnomah County section)",
     "summary": "Multnomah County lists NW Cornelius Pass Road (Skyline Boulevard \u2013 County Line) among the road projects in its Roads Capital Improvement Plan."
    }
   ]
  },
  {
   "id": "wc-mstip-cornelius-roadsafety",
   "stage": "access-research",
   "kind": "road-status",
   "organization": "Washington County Land Use & Transportation",
   "authority": "county:washington",
   "sourceClass": "TIER_1_AUTHORITATIVE",
   "sourceType": "county funding program",
   "title": "Multnomah/Washington County MSTIP 3f funding allocation",